{
  "profile": "https://research-harness.dev/schema/mif-container/v1",
  "sourceInstance": {
    "namespace": "sample-instance",
    "corpusUrl": null
  },
  "exportScope": {
    "type": "subset",
    "topic": "edge-systems",
    "selector": "tag:bandwidth",
    "generatedAt": "2026-07-10T00:00:00Z"
  },
  "ontologyBindings": [
    {
      "packId": "mif-generic",
      "version": "1.0.0"
    }
  ],
  "resources": [
    {
      "mifType": "finding",
      "path": "findings/lc-bandwidth.json",
      "ontologyType": "concept",
      "digest": "sha256:0fad3b39edea50e6f45eef0a4aef333ae752e941f5611d0c337a04134746d7fb"
    }
  ],
  "boundaryReferences": [
    {
      "target": "urn:mif:b354d7c3-1d8e-5ab0-a0dc-f7d5b0c543ca",
      "reason": "out-of-scope"
    }
  ],
  "manifestDigest": "sha256:a2e0b2804efe1a5a4a1310a903da323958df8f58d2fe9622ac5a93cbdf8ec811",
  "createdAt": "2026-07-10T00:00:00Z"
}
